Job Name,Company,Rating,Location,Salary,Description,Headquarters,Size,Founded,Type of ownership,Industry,Sector,Revenue,Competitors,hourly,employer provided,min_salary,max_salary,avg_salary,job_state,age,python_yn,R_yn,spark_yn,aws_yn,excel_yn
"Scientist, Data I",ABBVIE,3.9,"Crystal Lake, IL",$67K - $92K (Glassdoor est.),"AbbVie’s Operations Business Insights (OBI) group is continuously innovating to transform AbbVie operations organization to enable the use of data and analytics to drive world-class innovation, performance, and agility across many functional areas.
We are looking for an Associate Data Scientist with entry-level experience in Software Engineering and Data Engineering who aspire to further advance in Data Science skills.
The Associate Data Scientist will assist in bringing machine learning solutions to life by translating business requirements into deployable applications, using complex SQL queries for data query and writing efficient R/Python codes.

Responsibilities:",-1,10000+ Employees,2013,Company - Public,Biotech & Pharmaceuticals,Pharmaceutical & Biotechnology,$10+ billion (USD),-1,0,0,67.0,92.0,79.5,IL,10,1,0,0,1,0
Data Scientist (All Levels),Noblis,4.4,"Reston, VA",Employer Provided Salary:$84K - $147K,"Responsibilities:
Noblis is seeking to hire Data Scientists (All Levels) in Reston, VA

As a Data Scientist with our team, you will be working with our federal clients to rapidly develop innovative proof of concept and prototype solutions for our clients’ immediate mission challenges. In your role, you will work on multiple projects with teams of other data scientists, software developers, and SMEs to apply the best practices and state of the art data science and machine learning processes. As a data scientist you will be working closely with federal clients providing services to develop AI/ML models and weights to selected data to facilitate object detection, data triage, search/optimization, inference, facial recognition, behavior detection, and automated discovery and decision making, maintaining model versioning system and experience identifying new vulnerabilities in models.

On our team, you will:
Qualifications:

Client Engagement: · Learn about and support Noblis’ client engagement, corporate values, and corporate strategic priorities, including providing input to proposal writers. · Build a productive relationship with your client and understand their structure and goals. · Participate in the proposal process by providing input to proposal writers. Overview:",-1,1001 to 5000 Employees,1996,Nonprofit Organization,Business Consulting,Management & Consulting,$100 to $500 million (USD),-1,0,1,84.0,147.0,115.5,VA,27,0,0,0,1,0
Data Scientist (L6) - Ads,Netflix,4.3,"Los Angeles, CA",$104K - $181K (Glassdoor est.),"Los Angeles, California
Advertising
At Netflix, we seek to entertain the world. We have more than 200 million members in 190 countries, reflecting that great stories can come from anywhere and be loved everywhere.

In Nov 2022, we launched a new lower-priced, ad-supported tier for our customers. We are now continuing to build on our goal of providing more choice for consumers and a premium, better-than-linear TV brand experience for advertisers. That said, we are looking for the founding members of this new business area for Netflix!

The Ads Data Science and Engineering team at Netflix’s mission is to help build the foundation of the ads business at Netflix. We conduct analyses and develop analytic tools, build predictive models and algorithms using machine learning, all with the goal of creating more choices and joy for our members. You’ll work closely with partner teams to build workflows, provide recommendations and drive success on end-to-end analytics initiatives in this 0 -1 space.",-1,5001 to 10000 Employees,1997,Company - Public,Internet & Web Services,Information Technology,$5 to $10 billion (USD),-1,0,0,104.0,181.0,142.5,CA,26,0,0,0,1,0
Junior Data Scientist,Soothsayer Analytics,2.9,"Livonia, MI",$81K - $113K (Glassdoor est.),"Junior Data Scientist
Working Hours : Full Time(W2)
Experience : 1+Years
Locations : Livonia , Michigan

Soothsayer is seeking Data Scientist who has an interest in solving challenging ML/ AI problems. The Data Science team works on a variety of exciting analytics (ML, AI) projects.",-1,Unknown,-1,Company - Private,Information Technology Support Services,Information Technology,Unknown / Non-Applicable,-1,0,0,81.0,113.0,97.0,MI,-1,0,0,0,1,0
Junior Data Scientist,Choice Fitness,3.3,"Atlanta, GA",$71K - $102K (Glassdoor est.),"As a Junior Data Scientist, you will help support the Senior Data Scientist in analysis and research, and machine learning modeling that is underpinning new and current products. Additionally, the Junior Data Scientist will support the Data Engineer in building new data pipelines including new ETL functions.

Minimum Qualifications

Bachelors degree in STEM field using applied statistics and/or machine learning with two plus years of experience.

Strong statistical and mathematical skills: You should have a strong understanding of statistical concepts such as probability theory, hypothesis testing, regression analysis, and machine learning algorithms.

You should be proficient in at least one programming language, such as Python or R. You should also be familiar with SQL for data querying and manipulation.

You should be able to clean, manipulate, and transform data using tools like pandas and numpy in Python or tidyverse in R. You should also be able to create effective data visualizations using libraries such as Matplotlib or ggplot2.

You should have a basic understanding of machine learning algorithms such as linear regression, logistic regression, decision trees, and clustering techniques.

You should have excellent communication skills, including the ability to clearly explain complex technical concepts to non-technical stakeholders.

The ability to work collaboratively with other team members, including data engineers, data analysts, and business stakeholders, can be beneficial for you in delivering successful projects.

You should be able to identify and solve complex problems, often with incomplete or imperfect data.

You should have excellent attention to detail, ensuring that your data analysis is accurate and error-free.

You should be willing to learn new skills and keep up with the latest industry trends and developments.

Nice-to-have skills and Experience

Experience with AGILE/SCRUM/JIRA.

Experience with the AWS cloud platform.

Understanding of deep learning algorithms.

Having domain expertise in criminal justice, crime analysis and/or risk calculation.

Knowledge of data ethics and privacy.

Project management skills scoping, planning, and executing.",-1,Unknown,-1,Company - Public,Beauty & Wellness,Personal Consumer Services,Unknown / Non-Applicable,-1,0,0,71.0,102.0,86.5,GA,-1,1,0,0,1,1
Sr Data Scientist,f5,4.1,"San Jose, CA",Employer Provided Salary:$160K - $241K,"At F5, we strive to bring a better digital world to life. Our teams empower organizations across the globe to create, secure, and run applications that enhance how we experience our evolving digital world. We are passionate about cybersecurity, from protecting consumers from fraud to enabling companies to focus on innovation.

Everything we do centers around people. That means we obsess over how to make the lives of our customers, and their customers, better. And it means we prioritize a diverse F5 community where each individual can thrive.
Today, as part of F5, Security products identify and stop automated attacks and fraud against web and mobile applications of the Fortune Global 2000. Tomorrow, we’ll need to fight even more sophisticated adversaries, while helping human users to have ever more friction-less experience. Come be a part of our unparalleled team that is responsible for making the Internet a safer place for everyone.
The Position
The annual U.S. base pay range for this position is: $160,499.00 - $240,749.00",-1,5001 to 10000 Employees,1996,Company - Public,Computer Hardware Development,Information Technology,$1 to $5 billion (USD),-1,0,1,160.0,241.0,200.5,CA,27,0,0,0,1,0
Data Scientist (Remote),Mercy,3.5,"Chesterfield, MO",$77K - $114K (Glassdoor est.),"We're a Little Different

Our mission is clear. We bring to life a healing ministry through our compassionate care and exceptional service.

At Mercy, we believe in careers that match the unique gifts of unique individuals - careers that not only make the most of your skills and talents, but also your heart. Join us and discover why Modern Healthcare Magazine named us in its ""Top 100 Places to Work.""

Overview: Data Scientist

Position can be done Remote (work from home).

Mercy is seeking a Data Scientist to work within a team of other advanced professional data scientists, engineers, and application developers in the generation, extraction, and compilation of data to perform creative, high-quality, state-of-the-art analyses and evaluations that produce insights, support decision-making, and drive impact within a leading and transforming healthcare organization. This position will support Mercys efforts to deliver on the vision of personalized, predictive, and proactive care. The candidate should demonstrate expertise with data extraction, management, analysis with data analytics tools, and be able deliver outputs on a timeline. The candidate should be able to effectively document, develop, and communicate project plans and analytic findings with a variety of technical/non-technical stakeholders.





Day-one comprehensive health, vision and dental coverage, PTO, tuition reimbursement and employer-matched retirement funds are just a few of the great benefits offered to eligible co-workers, including those working 32 hours or more per pay period!



At Mercy, our supportive community will be behind you every step of your day, especially the tough ones. You will have opportunities to pioneer new models of care and transform the health care experience through advanced technology and innovative procedures. We're expanding to help our communities grow. Join us and be a part of it all.



Compassion and professionalism go hand-in-hand with us. Having a positive outlook and a strong sense of advocacy is in perfect step with our mission and vision. We're also collaborative and unafraid to do a little extra to deliver excellent care - that's just part of our commitment. If that sounds like a good fit for you, we encourage you to apply.

Mercy has determined this is a safety-sensitive position. The ability to work in a constant state of alertness and in a safe manner is an essential function of this job.",-1,10000+ Employees,1871,Nonprofit Organization,Health Care Services & Hospitals,Healthcare,$100 to $500 million (USD),-1,0,0,77.0,114.0,95.5,MO,152,0,0,0,1,1
Marketing Data Scientist,Sephora USA,3.6,"San Francisco, CA",Employer Provided Salary:$153K - $169K,"Position
Marketing Data Scientist

Profile
Job ID: 230380
Location Name: FSC REMOTE SF/NY/DC -173(USA_0173)
Address: FSC, San Francisco, CA 94105, United States (US)
Job Type: Full Time
Position Type: Regular
Job Function: Marketing
Yes",-1,10000+ Employees,1969,Company - Private,Beauty & Personal Accessories Stores,Retail & Wholesale,$1 to $5 billion (USD),-1,0,1,153.0,169.0,161.0,CA,54,0,0,0,1,0
Data Scientist (REMOTE),"General Dynamics Mission Systems, Inc",3.8,Remote,Employer Provided Salary:$120K - $133K,"Basic Qualifications :
Requires a Bachelor’s degree in Engineering, or a related Science or Mathematics field. Also requires 5+ years of job-related experience, or a Master's degree plus 3 years of job-related experience.

Due to the nature of work performed within our facilities, U.S. citizenship is required.
Responsibilities for this Position:
GDMS’ Deep Learning Analytics Center of Excellence (DLACoE) is looking for a data science professional having a wide range of data integration, data visualization, big data, and programming skills. Candidates should possess a demonstrated understanding of machine learning and profiency in software engineering with the ability to apply these skills under real world conditions.

Our Commitment to You:


Salary Note: This estimate represents the typical salary range for this position based on experience and other factors (geographic location, etc.). Actual pay may vary. Combined Salary Range: USD $119,700.00 - USD $132,700.00 /Yr. Company Overview:",-1,10000+ Employees,1952,Subsidiary or Business Segment,Aerospace & Defense,Aerospace & Defense,$1 to $5 billion (USD),-1,0,1,120.0,133.0,126.5,Remote,71,0,0,0,1,1
Data Scientist I,Navy Federal Credit Union,4.1,"Vienna, VA",$96K - $133K (Glassdoor est.),"Provide independent data science, machine learning, and analytical insights using member, financial, and organizational data to support mission critical decision making for various areas of the organization. Understand business needs and identify opportunities for new products, services, and process optimization to meet business objectives through the use of cutting-edge data science. Create descriptive, predictive, and prescriptive models and insights to drive impact across the organization. Conduct work assignments of increasing complexity, under moderate supervision with some latitude for independent judgment. Intermediate professional within field; requires moderate skill set and proficiency in discipline.",-1,10000+ Employees,1933,Self-employed,Banking & Lending,Financial Services,Unknown / Non-Applicable,-1,0,0,96.0,133.0,114.5,VA,90,0,0,0,1,0
Head of Data,Calendly,3.6,"Atlanta, GA",$103K - $150K (Glassdoor est.),"About the team & opportunity
What's so great about working on Calendly's Engineering team?
We make things possible for our customers through impactful innovation.
As Head of Data, you will guide the design and implementation of a multi-disciplinary data team comprising data architecture, data engineering, machine learning and data science to form the foundation of business and product intelligence for Calendly. This role leads the teams in the creation, support, and evolution of the cloud technology underpinning a hyper-growth SaaS solution. In partnership with development, product, and business partners, you own the data structures, models, and ecosystem of services that inform business strategy, improve our understanding of our customers, and enable an intelligent product experience. Your team strives for excellence in flexibility, scalability and security of Calendly's greatest untapped asset!",-1,501 to 1000 Employees,2013,Company - Private,Software Development,Information Technology,Unknown / Non-Applicable,-1,0,0,103.0,150.0,126.5,GA,10,0,0,0,1,1
Jr. Data Scientist,Kyla,3.5,"San Jose, CA",$91K - $131K (Glassdoor est.),"Job Type: Full Time
We are looking for Jr. Data Scientists to join our team.
Kyla is the next generation of healthcare tech. Our mission is to help people live longer and healthier. With the latest AI technologies, we provide the best digital healthcare for everyone. We have several digital products such as mobile app, and three web applications for companies and doctors. We work with Fortune 500 companies. Our solutions are used by thousands, and recently we won the Exceptional Innovation By The 2020 Pandemic Tech Innovation Awards. Our team is bright minds who love their job and development and are not afraid of working in a fast-growing lean startup.
If you would like to join us, do not hesitate to apply.
Required skills:",-1,1 to 50 Employees,-1,Company - Private,-1,-1,Unknown / Non-Applicable,-1,0,0,91.0,131.0,111.0,CA,-1,0,0,0,1,0
Data Scientist,Upen Group Inc,-1.0,"Irving, TX",Employer Provided Salary:$40K - $64K,"We are a leading job agency seeking a Junior Data Analyst to join our team and work with some of our top vendors. The ideal candidate will have strong analytical skills, excellent attention to detail, and a desire to learn and grow in the field of data analysis.
Responsibilities:
Collect, manipulate and analyze data from various sources
Prepare reports and visualizations to communicate findings to stakeholders
Identify trends and patterns in data to help inform business decisions
Collaborate with cross-functional teams to develop and implement data-driven solutions
Requirements:",-1,-1,-1,-1,-1,-1,-1,-1,0,1,40.0,64.0,52.0,TX,-1,0,0,0,1,1
Jr. Data Scientist,Florida Atlantic University,4.0,"Boca Raton, FL",Employer Provided Salary:$25.00 Per Hour,"For more information on everything FAU has to offer, please visit
www.fau.edu/jobs
.
Position Summary:
The Florida Atlantic University Center for Online and Continuing Education is seeking a Junior Data Scientist (JDS).
The successful candidate will have an enthusiasm for leveraging technology to enhance student-learning environments and improve student-learning outcomes. Experienced in transformative Artificial Intelligence innovations, the JDS will work with a team of researchers focused on supporting effective student-learning. The JDS will work on projects geared toward successful student preparedness for the digitally connected and competitive workforce. Those encouraged to apply must have a desire to propel a career in research and data analytics related to digital learning with the tools, skills, and experience gained from being a team member in the FAU Center for Online and Continuing Education.

Master's of Science degree from an accredited institution in Information Technology and Management, Computer Science and Data Analytics; or in an appropriate area of specialization required.

Preferred Skills:

Experience with statistical software, such as SPSS or similar.

Experience collaborating on academic teams with individuals from varying professional backgrounds.

Functional knowledge of varying coding languages.

Outstanding organizational abilities and attentiveness to detail.

Experience working in the Canvas Learning Management System.

Willingness to learn software programs and coding languages, as needed.

Excellent communication skills.

Willingness to flex and adapt.

Willingness to serve as a team player.

Problem-solving skills.
$25.00 per hour.
eLearning Staff
Boca Raton
Monday - Friday, 8 a.m. - 5 p.m.
2023-07-11
Individuals with disabilities requiring accommodation, please call 561-297-3057. 711

Temporary positions are not established positions and are paid from OPS funds. Temporary positions are usually not eligible for benefits and retirement; however, they may be eligible for health insurance coverage depending on the average hours worked per week. They provide full-time or part-time employment in an exempt or non-exempt employment situation based on job duties and salary in accordance with the Fair Labor Standards Act (FLSA). Temporary positions do not have layoff rights and may be terminated without prior notice. Applicants hired into Temporary positions may apply for a regular appointment should a vacancy become available.

Successful completion of a background check, which may include a motor vehicle check, credit check, fingerprinting or additional screening, is required for the selected candidate prior to the start date.

A resume and a cover letter are required for this position. Make sure to attach these required documents in the Attachments section of the application. Any missing required documents will result in disqualification.",-1,1001 to 5000 Employees,1960,College / University,Colleges & Universities,Education,$100 to $500 million (USD),-1,1,1,25.0,0.0,25.0,FL,63,0,0,0,1,1
Data Scientist,Vetro Tech Inc,3.9,"Seattle, WA",Employer Provided Salary:$84K - $99K,"We are looking for a Data Scientist to analyze large amounts of raw information to find patterns that will help improve our company. We will rely on you to build data products to extract valuable business insights. In this role, you should be highly analytical with a knack for analysis, math and statistics. Critical thinking and problem-solving skills are essential for interpreting data. We want to see a passion for machine-learning and research. Your goal will be to help our company analyze trends to make better decisions.
Responsibilities
Identify valuable data sources and automate collection processes
Undertake preprocessing of structured and unstructured data
Analyze large amounts of information to discover trends and patterns",-1,Unknown,-1,Company - Public,Staffing & Subcontracting,Human Resources & Staffing,Unknown / Non-Applicable,-1,0,1,84.0,99.0,91.5,WA,-1,0,0,0,1,0
Data Scientist - 300269,Grainger,4.1,"Lake Forest, IL",$93K - $125K (Glassdoor est.),"W.W. Grainger, Inc. is seeking a Data Scientist in Lake Forest, IL with the following requirements: Master’s degree in Statistics, Mathematics, Data Science, Computer Science or related field plus 1 year related experience. Prior experience must include: Analyze and interpret statistical data in the form of data visualization and statistic calculation, translate numerical findings into actionable insights and implementable solutions; Design and conduct experiments, collect the data to measure results and test hypotheses, create inferences and recommendations; Design, implement, and validate statistical and machine learning models like regression, decision trees, clustering, and time series modeling; Utilize statistical computer languages in SQL, Python, R, IBM SPSS Statistics, and MS Office; Present clear and concise results to business partners to adopt and implement analytical recommendations. Up to 20% remote work allowed.

Please submit resume to https://jobs.grainger.com/, reference job #300269",-1,10000+ Employees,1927,Company - Public,Wholesale,Retail & Wholesale,$10+ billion (USD),-1,0,0,93.0,125.0,109.0,IL,96,1,0,0,1,0
Junior Data Scientist,Augray,3.9,"Brookfield, WI",Employer Provided Salary:$55K - $60K,"Brookfield, WI, USA
Summary:
Hiring Fresher to 1 year experience in Data Science, ML with python and strong analytical skills with a passion to take part in R&D.
About AugRay:
Augray is on a mission to build next generation method of communication using Extended Reality – XR (AR/ VR/ MR) technologies and change the way businesses re conducted and how interactions happen with people. In an age where innovation is happening all around us, there’s commonality – people are driving these changes. We offer a solution that helps to articulate product demonstration and how people conversation takes place using smartphones and wearable glasses.",-1,51 to 200 Employees,2014,Subsidiary or Business Segment,Information Technology Support Services,Information Technology,Unknown / Non-Applicable,-1,0,1,55.0,60.0,57.5,WI,9,1,0,0,1,0
Data Scientist Co-Op - Masters Degree - Fall 2023,Torc Robotics,4.3,"Austin, TX",Employer Provided Salary:$31.00 - $37.00 Per Hour,"About the Company
At Torc, we have always believed that autonomous vehicle technology will transform how we travel, move freight, and do business.
A leader in autonomous driving since 2007, Torc has spent over a decade commercializing our solutions with experienced partners. Now a part of the Daimler family, we are focused solely on developing software for automated trucks to transform how the world moves freight.
Join us and catapult your career with the company that helped pioneer autonomous technology, and the first AV software company with the vision to partner directly with a truck manufacturer.",-1,501 to 1000 Employees,2007,Company - Private,Software Development,Information Technology,$25 to $100 million (USD),-1,1,1,31.0,37.0,34.0,TX,16,0,0,0,1,0
Data Scientist - All Levels,Silver Edge,-1.0,"Chantilly, VA",$82K - $126K (Glassdoor est.),"Description
The Data Scientist will act in a consultant capacity for assessments of data science requests. Data Scientist to conduct hands-on machine learning. Required Skills

Demonstrated experience with the following:
Experience with Python, R, MATLAB, SQL, and DS tools (PyTorch, TensorFlow, Pandas, etc.).
Familiarity with virtualized data science environment preferred.
Creating user friendly repo rts using various databases, programs, and scripts.
About Silver Edge
Map a new path to mission accomplished. SilverEdge Government Solutions was founded on the belief that nurturing talent and collaborating closely with our customers enables us to think big and deliver the best for our country. Our mission is to bring top technology talent together to solve the world’s most challenging problems while protecting the United States and our allies.
SilverEdge Government Solutions, LLC is an Equal Opportunity Employer and applicants receive lawful consideration for employment without regard to race, religion, color, gender, age, national origin, disability, or veteran status.",-1,201 to 500 Employees,-1,Company - Private,-1,-1,Unknown / Non-Applicable,-1,0,0,82.0,126.0,104.0,VA,-1,1,0,0,1,0
