Job Name,Company,Rating,Location,Salary,Description,Headquarters,Size,Founded,Type of ownership,Industry,Sector,Revenue,Competitors,hourly,employer provided,min_salary,max_salary,avg_salary,job_state,age,python_yn,R_yn,spark_yn,aws_yn,excel_yn
Sr Data Scientist,Market America Inc,3.1,"Monterey, CA",$125K - $179K (Glassdoor est.),"Market America Worldwide – Shop.com, a global e-commerce and digital marketing company that specializes in one-to-one marketing, is seeking a top-notch Senior Data Scientist to join our team. Remote opportunity can be available to candidates based in states of CA, NC, FL, NY, CT, or WI.

Position Summary

As Data Scientist you will have an important role in helping millions of customers on our SHOP.COM and Market America Worldwide multi-country and multi-language global eCommerce websites.

We are seeking an experienced data scientist that could help in doing statistical analysis of a/b tests, build machine learning ranking models for search result ranking and personalized recommendations, build models for category classifiers in predicting categories for a product or search keyword, fine tune some of the out of box models such as word2vec or Bert, text embedding, customer segmentations models, and help support various business decision making processes.

If you are passionate about Machine Learning / Artificial Intelligence, this is a highly visible role that will provide you the opportunity to make a huge impact in our business and a difference to millions of customers worldwide.

Job Duties and Responsibilities

Work through all phases of development including data analysis, model prototyping, model evaluation (offline / online), training data set, automation, and maintenance

Collaborate with other teams including search and data engineering, web and marketing analysts, data analysts, project managers, systems team, and other contractors/consultants

Write code in Python / R using various statistical techniques and machine learning models, maintain all the code in repository such as Git / Bitbucket

Develop visualization of data with tools such as Jupyter notebooks and integrations with Tableau

A/B test evaluation, share the findings with the team. Ability to communicate summarized results to technical and non-technical stakeholders to help them make decisions.

Work with search engineers and data engineers in integrating ML models, analytics pipeline, work with ML Engineers/Data Engineers in deploying models to production, participate in MLOps processes

Work with stakeholders throughout the organization to identify opportunities for leveraging machine learning techniques across other business verticals

Mentor junior team members, define architecture, code review, hands-on development and deliver the work in sprint cycle

Take complete ownership from requirements, solution design, development, production launch and post launch production support. Participate in code reviews and regular on-call rotations.

Desire to learn ML best practices, participate in other forums / conferences, and continue to bring latest trends in Machine Learning / Artificial Intelligence

Education and Experience

BS / Masters / PhD in Computer Science (or related field) with 5+ years of hands-on experience in statistical and machine learning algorithms on real world problems

Experience in using ML friendly tech stack, PyTorch, Tensorflow, scikit-learn, pandas, Python / R, deep learning frameworks, comfortable with database SQL queries, AWS Athena, BigQuery and Google Analytics tagging/integration, ML models for information retrieval algorithms, transformers/encoders, ANN/KNN search

Hands-on industry experience in building real time ranking and recommendations models, text embedding, neural networks, deep learning, and other NLP techniques for search query understanding

Strong programming skills, statistical techniques, clustering techniques, predictive modeling, AI/ML/NLP, architecture diagramming, problem-solving and debugging skills

A team player, willingness to learn new technologies, phenomenal communication and influencing skills

Nice to have

Prior industry experience in e-Commerce domain

Experience in deploying ML models to production, familiarity with MLOps

Experience in utilizing ML platforms such as Amazon SageMaker, AWS Lambda or others

Experience in performing vector search, image search / visual search

Familiarity in using search engines like Elasticsearch or other vector search engines

Market America offers competitive salary and generous benefits, including health, dental, vision, life, short and long-term disability insurance, and a 401(k) retirement plan with company match.

Qualified candidates should apply online. This position will work remotely based from our California offices.

Market America is proud to be an equal opportunity employer.

Market America | SHOP.COM is changing the way people shop and changing the economic paradigm so anyone can become financially independent by creating their own economy and converting their spending into earning with the Shopping Annuity®.

ABOUT MARKET AMERICA, INC. & SHOP.COM

Market America Worldwide | SHOP.COM is a global e-commerce and digital marketing company that specializes in one-to-one marketing and is the creator of the Shopping Annuity . Its mission is to provide a robust business system for entrepreneurs, while providing consumers a better way to shop. Headquartered in Greensboro, North Carolina, and with eight sites around the globe, including the U.S., Market America Worldwide was founded in 1992 by Founder, Chairman & CEO JR Ridinger. Through the company's primary, award-winning shopping website, SHOP.COM, consumers have access to millions of products, including Market America Worldwide exclusive brands and thousands of top retail brands. Further, SHOP.COM ranks 19th in Newsweek magazine's 2021 Best Online Shops, No. 52 in Digital Commerce 360's (formerly Internet Retailer) 2021 Top 1,000 Online Marketplaces, No. 79 in Digital Commerce 360's 2021 Top 1,000 Online Retailers and No. 11 in the 2021 Digital Commerce 360 Primary Merchandise Category Top 500. The company is also a two-time winner of the Better Business Bureau's Torch Award for Marketplace Ethics and was ranked No. 15 in The Business North Carolina Top 125 Private Companies for 2021. By combining Market America Worldwide's entrepreneurial business model with SHOP.COM's powerful comparative shopping engine, Cashback program, Hot Deals, ShopBuddy®, Express Pay checkout, social shopping integration and countless other features, the company has become the ultimate online shopping destination.

MarketAmerica.com

SHOP.COM",-1,501 to 1000 Employees,1992,Subsidiary or Business Segment,Advertising & Public Relations,Media & Communication,$100 to $500 million (USD),-1,0,0,125.0,179.0,152.0,CA,31,1,0,0,1,0
Data Scientist,Toyota,3.9,"Plano, TX",$95K - $130K (Glassdoor est.),"Overview
Who we are
At Toyota, we are reimagining mobility through innovative, high-quality technology solutions designed to enhance lives and meet our company mission of “Producing Happiness for All.” If you are interested in reimagining mobility with us in an inclusive environment built on teamwork that puts respect for people first, we want to talk to you.
This position is based in Plano, TX
Toyota encourages all employees to live within a reasonable commuting distance of their assigned work location. Hybrid work from outside of the assigned work location may be permitted in a pre-approved list of states (AZ, CA, CO, GA, IL, IN, KY, MA, MI, MO, NJ, NY, OH, OR, TN, TX, VA, WV) with certain stipulations.",-1,10000+ Employees,1957,Company - Public,Transportation Equipment Manufacturing,Manufacturing,$10+ billion (USD),-1,0,0,95.0,130.0,112.5,TX,66,0,0,0,1,0
Data Scientist,Procal Technologies,3.8,Remote,Employer Provided Salary:$80K,"$80k USD/year
Remote
Fulltime
Brief Overview:
Performs duties related to data mining, machine learning, statistical modeling, and analytics to build algorithms that will result in massive improvements to the way Aaron’s does business. Responsible for developing and improving key decision systems and predictive models to drive maximum business impact.
Key Responsibilities:",-1,Unknown,-1,Company - Private,Business Consulting,Management & Consulting,Unknown / Non-Applicable,-1,0,1,80.0,0.0,80.0,Remote,-1,0,0,0,1,0
Data Scientist - 300269,Grainger,4.1,"Lake Forest, IL",$93K - $125K (Glassdoor est.),"W.W. Grainger, Inc. is seeking a Data Scientist in Lake Forest, IL with the following requirements: Master’s degree in Statistics, Mathematics, Data Science, Computer Science or related field plus 1 year related experience. Prior experience must include: Analyze and interpret statistical data in the form of data visualization and statistic calculation, translate numerical findings into actionable insights and implementable solutions; Design and conduct experiments, collect the data to measure results and test hypotheses, create inferences and recommendations; Design, implement, and validate statistical and machine learning models like regression, decision trees, clustering, and time series modeling; Utilize statistical computer languages in SQL, Python, R, IBM SPSS Statistics, and MS Office; Present clear and concise results to business partners to adopt and implement analytical recommendations. Up to 20% remote work allowed.

Please submit resume to https://jobs.grainger.com/, reference job #300269",-1,10000+ Employees,1927,Company - Public,Wholesale,Retail & Wholesale,$10+ billion (USD),-1,0,0,93.0,125.0,109.0,IL,96,1,0,0,1,0
Junior Data Scientist,Augray,3.9,"Brookfield, WI",Employer Provided Salary:$55K - $60K,"Brookfield, WI, USA
Summary:
Hiring Fresher to 1 year experience in Data Science, ML with python and strong analytical skills with a passion to take part in R&D.
About AugRay:
Augray is on a mission to build next generation method of communication using Extended Reality – XR (AR/ VR/ MR) technologies and change the way businesses re conducted and how interactions happen with people. In an age where innovation is happening all around us, there’s commonality – people are driving these changes. We offer a solution that helps to articulate product demonstration and how people conversation takes place using smartphones and wearable glasses.",-1,51 to 200 Employees,2014,Subsidiary or Business Segment,Information Technology Support Services,Information Technology,Unknown / Non-Applicable,-1,0,1,55.0,60.0,57.5,WI,9,1,0,0,1,0
Data Scientist (L6) - Ads,Netflix,4.3,"Los Angeles, CA",$104K - $181K (Glassdoor est.),"Los Angeles, California
Advertising
At Netflix, we seek to entertain the world. We have more than 200 million members in 190 countries, reflecting that great stories can come from anywhere and be loved everywhere.

In Nov 2022, we launched a new lower-priced, ad-supported tier for our customers. We are now continuing to build on our goal of providing more choice for consumers and a premium, better-than-linear TV brand experience for advertisers. That said, we are looking for the founding members of this new business area for Netflix!

The Ads Data Science and Engineering team at Netflix’s mission is to help build the foundation of the ads business at Netflix. We conduct analyses and develop analytic tools, build predictive models and algorithms using machine learning, all with the goal of creating more choices and joy for our members. You’ll work closely with partner teams to build workflows, provide recommendations and drive success on end-to-end analytics initiatives in this 0 -1 space.",-1,5001 to 10000 Employees,1997,Company - Public,Internet & Web Services,Information Technology,$5 to $10 billion (USD),-1,0,0,104.0,181.0,142.5,CA,26,0,0,0,1,0
Data Scientist,NutaNXT Technologies,4.8,"Santa Clara, CA",$108K - $149K (Glassdoor est.),"Job Description
As a Data Scientist, you will help healthcare run efficiently through AI models that improve the distribution and manufacturing of healthcare products. You will understand key problems faced by business partners across the business, and ask good questions. You will brainstorm possible statistical solutions with help from Senior Data Scientists. You will own AI experiments, failing fast and pivot to the right solution. Finally, you will operationalize models with help from Senior Machine Learning Engineers.
Responsibilities
Extract data from multiple data sources like Microsoft SQL Server, Oracle, Azure Blob, and Azure SQL using SQL or Python",-1,1 to 50 Employees,-1,Company - Private,-1,-1,Unknown / Non-Applicable,-1,0,0,108.0,149.0,128.5,CA,-1,1,0,0,1,0
Data Scientist I,VirginPulse,3.4,Remote,Employer Provided Salary:$95K,"Overview:
Join Virgin Pulse Today!

Virgin Pulse is the #1 health and wellbeing navigation platform. Our mission is to change lives for good. We empower 14 million users to get and stay healthy every day by making better choices.

We are looking for a Data Scientist I to join our team who embodies our values: People Matter, We Deliver, One Team One Dream, and Grow Forward. By joining us, you will gain access to health and wellbeing resources, an inclusive global network of nearly 2,000 employees, learning development opportunities, and more.
Responsibilities:
Position Summary

The Data Scientist supports the organization's efforts to drive personalization and targeted intervention through solid statistical and modeling skill set. A successful candidate will have a desire for continuous learning and strong interpersonal relationship skills.
Qualifications:",-1,501 to 1000 Employees,2004,Company - Private,Computer Hardware Development,Information Technology,$100 to $500 million (USD),-1,0,1,95.0,0.0,95.0,Remote,19,0,0,0,1,0
Data Scientist,OneMagnify,4.4,"Detroit, MI",$102K - $141K (Glassdoor est.),"OneMagnify is a one-of-a-kind combination of technology, creative, strategy, data, analytics, and a wide range of marketing services that cut across multiple practice and solution areas to deliver a whole that is truly greater than the sum of its parts. Today’s sophisticated business and marketing landscape requires a fresh, vigilant, and more connected approach to human communications – and we get it.
We’re always looking for diverse, passionate, and skilled candidates to join our award-winning work environments. Our offices have been rated Top, Best, and Coolest places to work by numerous sources for multiple years in a row dating back to 2010. In fact, we were recently rated one of the Best and Brightest companies to work for in the nation. Apply today. Show us what you can do. You might be exactly who we need.
We are looking for a client facing Data Scientist who is excited to create exceptional client partnerships. This role is perfect for a creative problem solver with a vision of how to harness the power of data to help clients make informed decisions.
About You:",-1,201 to 500 Employees,1967,Company - Private,Advertising & Public Relations,Media & Communication,Unknown / Non-Applicable,-1,0,0,102.0,141.0,121.5,MI,56,0,0,0,1,0
Data Scientist,Parsons,3.9,Remote,Employer Provided Salary:$24.18 - $42.31 Per Hour,"In a world of possibilities, pursue one with endless opportunities. Imagine Next!
When it comes to what you want in your career, if you can imagine it, you can do it at Parsons. Imagine a career working with intelligent, diverse people sharing a common quest. Imagine a workplace where you can be yourself. Where you can thrive. Where you can find your next, right now. We’ve got what you’re looking for.
Job Description:
Parsons is seeking a Data Scientist to support our efforts in advancing public health analytics and modeling. The successful candidate will have a strong background in data science, excellent communication skills, and experience working with diverse stakeholders in public health, academia, and the private sector. As a Data Scientist, you will play a critical role in expanding awareness, training, and sharing of best practices related to outbreak analytics and modeling, ultimately contributing to improved public health outcomes.


Not Applicable/None
This position is part of our Federal Solutions team.
Our Federal Solutions segment delivers resources to our US government customers that ensure the success of missions around the globe. Our diverse, intelligent employees drive the state of the art as they provide services and solutions in the areas of defense, security, intelligence, infrastructure, and environmental. We promote a culture of excellence and close-knit teams that take pride in delivering, protecting, and sustaining our nation's most critical assets, from Earth to cyberspace. Throughout the company, our people are anticipating what’s next to deliver the solutions our customers need now.
$24.18 - $42.31
We value our employees and want our employees to take care of their overall wellbeing, which is why we offer best-in-class benefits such as medical, dental, vision, paid time off, Employee Stock Ownership Plan (ESOP), 401(k), life insurance, flexible work schedules, and holidays to fit your busy lifestyle!
Parsons is an equal opportunity employer committed to diversity, equity, inclusion, and accessibility in the workplace. Diversity is ingrained in who we are, how we do business, and is one of our company’s core values. Parsons equally employs representation at all job levels for minority, female, disabled, protected veteran and LGBTQ+.
We truly invest and care about our employee’s wellbeing and provide endless growth opportunities as the sky is the limit, so aim for the stars! Imagine next and join the Parsons quest—APPLY TODAY!",-1,10000+ Employees,1944,Company - Public,Information Technology Support Services,Information Technology,$1 to $5 billion (USD),-1,1,1,24.18,42.31,33.245000000000005,Remote,79,0,0,0,1,1
Associate Data Scientist,Tencent,4.0,"Palo Alto, CA",Employer Provided Salary:$65K - $131K,"Work Mode:
Onsite
Responsibilities:
About Tencent
Tencent is a world-leading internet and technology company that develops innovative products and services to improve the quality of life of people around the world. Founded in 1998 with its headquarters in Shenzhen China, our guiding principle is to use technology for good.
We are not only a major video game publisher in the world, we also produce other high-quality digital content, enriching interactive entertainment experiences for people around the globe. We offer a range of services such as cloud computing, advertising, FinTech, and other enterprise services to support our clients' digital transformation and business growth.
About IEG






California
The base pay range for this position in the state(s) above is $65,450 to $130,900 per year. Actual pay is based on market location and may vary depending on job-related knowledge, skills, and experience. A sign on payment, relocation package, and restricted stock units may be provided as part of the compensation package, as well as other medical, financial, and/or other benefits, dependent on the specific position offered.",-1,10000+ Employees,1998,Company - Public,Internet & Web Services,Information Technology,Unknown / Non-Applicable,-1,0,1,65.0,131.0,98.0,CA,25,0,0,0,1,0
Junior Data Scientist,Choice Fitness,3.3,"Atlanta, GA",$71K - $102K (Glassdoor est.),"As a Junior Data Scientist, you will help support the Senior Data Scientist in analysis and research, and machine learning modeling that is underpinning new and current products. Additionally, the Junior Data Scientist will support the Data Engineer in building new data pipelines including new ETL functions.

Minimum Qualifications

Bachelors degree in STEM field using applied statistics and/or machine learning with two plus years of experience.

Strong statistical and mathematical skills: You should have a strong understanding of statistical concepts such as probability theory, hypothesis testing, regression analysis, and machine learning algorithms.

You should be proficient in at least one programming language, such as Python or R. You should also be familiar with SQL for data querying and manipulation.

You should be able to clean, manipulate, and transform data using tools like pandas and numpy in Python or tidyverse in R. You should also be able to create effective data visualizations using libraries such as Matplotlib or ggplot2.

You should have a basic understanding of machine learning algorithms such as linear regression, logistic regression, decision trees, and clustering techniques.

You should have excellent communication skills, including the ability to clearly explain complex technical concepts to non-technical stakeholders.

The ability to work collaboratively with other team members, including data engineers, data analysts, and business stakeholders, can be beneficial for you in delivering successful projects.

You should be able to identify and solve complex problems, often with incomplete or imperfect data.

You should have excellent attention to detail, ensuring that your data analysis is accurate and error-free.

You should be willing to learn new skills and keep up with the latest industry trends and developments.

Nice-to-have skills and Experience

Experience with AGILE/SCRUM/JIRA.

Experience with the AWS cloud platform.

Understanding of deep learning algorithms.

Having domain expertise in criminal justice, crime analysis and/or risk calculation.

Knowledge of data ethics and privacy.

Project management skills scoping, planning, and executing.",-1,Unknown,-1,Company - Public,Beauty & Wellness,Personal Consumer Services,Unknown / Non-Applicable,-1,0,0,71.0,102.0,86.5,GA,-1,1,0,0,1,1
"Scientist, Data I",ABBVIE,3.9,"Crystal Lake, IL",$67K - $92K (Glassdoor est.),"AbbVie’s Operations Business Insights (OBI) group is continuously innovating to transform AbbVie operations organization to enable the use of data and analytics to drive world-class innovation, performance, and agility across many functional areas.
We are looking for an Associate Data Scientist with entry-level experience in Software Engineering and Data Engineering who aspire to further advance in Data Science skills.
The Associate Data Scientist will assist in bringing machine learning solutions to life by translating business requirements into deployable applications, using complex SQL queries for data query and writing efficient R/Python codes.

Responsibilities:",-1,10000+ Employees,2013,Company - Public,Biotech & Pharmaceuticals,Pharmaceutical & Biotechnology,$10+ billion (USD),-1,0,0,67.0,92.0,79.5,IL,10,1,0,0,1,0
Data Scientist,PayPal,3.9,"San Jose, CA",Employer Provided Salary:$61K - $147K,"At PayPal (NASDAQ: PYPL), we believe that every person has the right to participate fully in the global economy. Our mission is to democratize financial services to ensure that everyone, regardless of background or economic standing, has access to affordable, convenient, and secure products and services to take control of their financial lives.
Job Description Summary: We are seeking an exceptional data scientist with a passion for data insights and relentless focus on execution: • You are curious and inquisitive: love digging into data and uncovering insights • You are hyper-analytical and intellectually honest, truly believing in data-driven decisions and communicating your ideas through storytelling • You are a highly motivated, result-oriented self-starter, enjoy working in a fast-paced environment, and can deliver successful results with minimal guidance
Job Description:
PayPal is committed to fair and equitable compensation practices.

Actual Compensation is based on various factors including but not limited to work location, and relevant skills and experience.

The total compensation for this practice may include an annual performance bonus (or other incentive compensation, as applicable), equity, and medical, dental, vision, and other benefits. For more information, visit https://www.paypalbenefits.com.

The U.S. national annual pay range for this role is $60900 to $147400",-1,10000+ Employees,1998,Company - Public,Internet & Web Services,Information Technology,$10+ billion (USD),-1,0,1,61.0,147.0,104.0,CA,25,0,0,0,1,0
Data Scientist,Vetro Tech Inc,3.9,"Seattle, WA",Employer Provided Salary:$84K - $99K,"We are looking for a Data Scientist to analyze large amounts of raw information to find patterns that will help improve our company. We will rely on you to build data products to extract valuable business insights. In this role, you should be highly analytical with a knack for analysis, math and statistics. Critical thinking and problem-solving skills are essential for interpreting data. We want to see a passion for machine-learning and research. Your goal will be to help our company analyze trends to make better decisions.
Responsibilities
Identify valuable data sources and automate collection processes
Undertake preprocessing of structured and unstructured data
Analyze large amounts of information to discover trends and patterns",-1,Unknown,-1,Company - Public,Staffing & Subcontracting,Human Resources & Staffing,Unknown / Non-Applicable,-1,0,1,84.0,99.0,91.5,WA,-1,0,0,0,1,0
