Job Name,Company,Rating,Location,Salary,Description,Headquarters,Size,Founded,Type of ownership,Industry,Sector,Revenue,Competitors,hourly,employer provided,min_salary,max_salary,avg_salary,job_state,age,python_yn,R_yn,spark_yn,aws_yn,excel_yn
Data Scientist I,VirginPulse,3.4,Remote,Employer Provided Salary:$95K,"Overview:
Join Virgin Pulse Today!

Virgin Pulse is the #1 health and wellbeing navigation platform. Our mission is to change lives for good. We empower 14 million users to get and stay healthy every day by making better choices.

We are looking for a Data Scientist I to join our team who embodies our values: People Matter, We Deliver, One Team One Dream, and Grow Forward. By joining us, you will gain access to health and wellbeing resources, an inclusive global network of nearly 2,000 employees, learning development opportunities, and more.
Responsibilities:
Position Summary

The Data Scientist supports the organization's efforts to drive personalization and targeted intervention through solid statistical and modeling skill set. A successful candidate will have a desire for continuous learning and strong interpersonal relationship skills.
Qualifications:",-1,501 to 1000 Employees,2004,Company - Private,Computer Hardware Development,Information Technology,$100 to $500 million (USD),-1,0,1,95.0,0.0,95.0,Remote,19,0,0,0,1,0
Junior Data Scientist,Choice Fitness,3.3,"Atlanta, GA",$71K - $102K (Glassdoor est.),"As a Junior Data Scientist, you will help support the Senior Data Scientist in analysis and research, and machine learning modeling that is underpinning new and current products. Additionally, the Junior Data Scientist will support the Data Engineer in building new data pipelines including new ETL functions.

Minimum Qualifications

Bachelors degree in STEM field using applied statistics and/or machine learning with two plus years of experience.

Strong statistical and mathematical skills: You should have a strong understanding of statistical concepts such as probability theory, hypothesis testing, regression analysis, and machine learning algorithms.

You should be proficient in at least one programming language, such as Python or R. You should also be familiar with SQL for data querying and manipulation.

You should be able to clean, manipulate, and transform data using tools like pandas and numpy in Python or tidyverse in R. You should also be able to create effective data visualizations using libraries such as Matplotlib or ggplot2.

You should have a basic understanding of machine learning algorithms such as linear regression, logistic regression, decision trees, and clustering techniques.

You should have excellent communication skills, including the ability to clearly explain complex technical concepts to non-technical stakeholders.

The ability to work collaboratively with other team members, including data engineers, data analysts, and business stakeholders, can be beneficial for you in delivering successful projects.

You should be able to identify and solve complex problems, often with incomplete or imperfect data.

You should have excellent attention to detail, ensuring that your data analysis is accurate and error-free.

You should be willing to learn new skills and keep up with the latest industry trends and developments.

Nice-to-have skills and Experience

Experience with AGILE/SCRUM/JIRA.

Experience with the AWS cloud platform.

Understanding of deep learning algorithms.

Having domain expertise in criminal justice, crime analysis and/or risk calculation.

Knowledge of data ethics and privacy.

Project management skills scoping, planning, and executing.",-1,Unknown,-1,Company - Public,Beauty & Wellness,Personal Consumer Services,Unknown / Non-Applicable,-1,0,0,71.0,102.0,86.5,GA,-1,1,0,0,1,1
Data Scientist (REMOTE),"General Dynamics Mission Systems, Inc",3.8,Remote,Employer Provided Salary:$120K - $133K,"Basic Qualifications :
Requires a Bachelor’s degree in Engineering, or a related Science or Mathematics field. Also requires 5+ years of job-related experience, or a Master's degree plus 3 years of job-related experience.

Due to the nature of work performed within our facilities, U.S. citizenship is required.
Responsibilities for this Position:
GDMS’ Deep Learning Analytics Center of Excellence (DLACoE) is looking for a data science professional having a wide range of data integration, data visualization, big data, and programming skills. Candidates should possess a demonstrated understanding of machine learning and profiency in software engineering with the ability to apply these skills under real world conditions.

Our Commitment to You:


Salary Note: This estimate represents the typical salary range for this position based on experience and other factors (geographic location, etc.). Actual pay may vary. Combined Salary Range: USD $119,700.00 - USD $132,700.00 /Yr. Company Overview:",-1,10000+ Employees,1952,Subsidiary or Business Segment,Aerospace & Defense,Aerospace & Defense,$1 to $5 billion (USD),-1,0,1,120.0,133.0,126.5,Remote,71,0,0,0,1,1
Data Scientist Co-Op - Masters Degree - Fall 2023,Torc Robotics,4.3,"Austin, TX",Employer Provided Salary:$31.00 - $37.00 Per Hour,"About the Company
At Torc, we have always believed that autonomous vehicle technology will transform how we travel, move freight, and do business.
A leader in autonomous driving since 2007, Torc has spent over a decade commercializing our solutions with experienced partners. Now a part of the Daimler family, we are focused solely on developing software for automated trucks to transform how the world moves freight.
Join us and catapult your career with the company that helped pioneer autonomous technology, and the first AV software company with the vision to partner directly with a truck manufacturer.",-1,501 to 1000 Employees,2007,Company - Private,Software Development,Information Technology,$25 to $100 million (USD),-1,1,1,31.0,37.0,34.0,TX,16,0,0,0,1,0
Junior Data Scientist,Club Quarters,3.2,"Stamford, CT",Employer Provided Salary:$80K - $100K,"Club Quarters Application- US

Junior Data Scientist
The Junior Data Scientist is a talented, creative, and motivated data scientist who loves data. The role is supporting our organization with data research and transformation for analytics. This individual will be responsible for ensuring data availability in a timely manner and data accuracy from many disparate systems for reporting and statistical analysis.

MAJOR DUTIES AND RESPONSIBILITIES
•
Build and maintain systems and processes by which we can review and verify the integrity and quality of our data before sharing with internal and external parties
REQUIRED QUALIFICATIONS
•
EDUCATION AND EXPERIENCE
KEY RELATIONSHIPS",-1,501 to 1000 Employees,-1,Company - Private,Hotels & Resorts,Hotels & Travel Accommodation,Unknown / Non-Applicable,-1,0,1,80.0,100.0,90.0,CT,-1,0,0,0,1,0
Junior Data Scientist,Augray,3.9,"Brookfield, WI",Employer Provided Salary:$55K - $60K,"Brookfield, WI, USA
Summary:
Hiring Fresher to 1 year experience in Data Science, ML with python and strong analytical skills with a passion to take part in R&D.
About AugRay:
Augray is on a mission to build next generation method of communication using Extended Reality – XR (AR/ VR/ MR) technologies and change the way businesses re conducted and how interactions happen with people. In an age where innovation is happening all around us, there’s commonality – people are driving these changes. We offer a solution that helps to articulate product demonstration and how people conversation takes place using smartphones and wearable glasses.",-1,51 to 200 Employees,2014,Subsidiary or Business Segment,Information Technology Support Services,Information Technology,Unknown / Non-Applicable,-1,0,1,55.0,60.0,57.5,WI,9,1,0,0,1,0
Data Scientist,FAST GROWING TREES LLC,4.2,Remote,Employer Provided Salary:$80K - $120K,"Description:

About the Company
Fast Growing Trees is one of the fastest-growing eCommerce companies in America. We enable people to live better, greener lives…one tree at a time. Founded in 2005, we have served over 1 million customers and continue to expand our market leadership and accelerate our growth within a fast-paced, entrepreneurial environment. We’re looking for leaders who want to make a positive difference every day.
About the Role
As a Data Scientist you will be responsible for building and maintaining demand planning models, setting inventory levels, and optimizing nursery space usage to ensure we are in stock for our customers. You will work with Merchandising and Marketing to understand key demand drivers to create realistic forward demand projections. You will analyze trend data and build automated tools to drive replenishment for our highly seasonal ecommerce business. Finally you will work with transportation, suppliers, and the nursery staff to ensure a steady flow of inventory to meet demand within space constraints. If you are passionate about using data to solve complex problems within Supply Chain, this is the role for you!
Requirements:",-1,51 to 200 Employees,2005,Company - Private,Home Furniture & Housewares Stores,Retail & Wholesale,Unknown / Non-Applicable,-1,0,1,80.0,120.0,100.0,Remote,18,0,0,0,1,0
Artificial Intelligence (AI) Trainer,Juji,4.0,"San Jose, CA",$102K - $161K (Glassdoor est.),"We are seeking highly motivated and talented AI trainers, who can teach our AI assistants natural language understanding and communication skills to deliver fun and satisfying conversational experience. In the meantime, you will gain valuable experience in the growing field of artificial intelligence and its application in diverse business settings.
Qualifications
Our ideal candidates are open-minded, multi-talented individuals who are sensitive to the nuances of interpersonal communication and adept at writing conversations. The individuals must feel comfortable working with customers and as well as with new technologies.
Required Expertise and Experience",-1,1 to 50 Employees,-1,Company - Public,-1,-1,Less than $1 million (USD),-1,0,0,102.0,161.0,131.5,CA,-1,0,0,0,1,0
Head of Data,Calendly,3.6,"Atlanta, GA",$103K - $150K (Glassdoor est.),"About the team & opportunity
What's so great about working on Calendly's Engineering team?
We make things possible for our customers through impactful innovation.
As Head of Data, you will guide the design and implementation of a multi-disciplinary data team comprising data architecture, data engineering, machine learning and data science to form the foundation of business and product intelligence for Calendly. This role leads the teams in the creation, support, and evolution of the cloud technology underpinning a hyper-growth SaaS solution. In partnership with development, product, and business partners, you own the data structures, models, and ecosystem of services that inform business strategy, improve our understanding of our customers, and enable an intelligent product experience. Your team strives for excellence in flexibility, scalability and security of Calendly's greatest untapped asset!",-1,501 to 1000 Employees,2013,Company - Private,Software Development,Information Technology,Unknown / Non-Applicable,-1,0,0,103.0,150.0,126.5,GA,10,0,0,0,1,1
Data Scientist (Remote),Mercy,3.5,"Chesterfield, MO",$77K - $114K (Glassdoor est.),"We're a Little Different

Our mission is clear. We bring to life a healing ministry through our compassionate care and exceptional service.

At Mercy, we believe in careers that match the unique gifts of unique individuals - careers that not only make the most of your skills and talents, but also your heart. Join us and discover why Modern Healthcare Magazine named us in its ""Top 100 Places to Work.""

Overview: Data Scientist

Position can be done Remote (work from home).

Mercy is seeking a Data Scientist to work within a team of other advanced professional data scientists, engineers, and application developers in the generation, extraction, and compilation of data to perform creative, high-quality, state-of-the-art analyses and evaluations that produce insights, support decision-making, and drive impact within a leading and transforming healthcare organization. This position will support Mercys efforts to deliver on the vision of personalized, predictive, and proactive care. The candidate should demonstrate expertise with data extraction, management, analysis with data analytics tools, and be able deliver outputs on a timeline. The candidate should be able to effectively document, develop, and communicate project plans and analytic findings with a variety of technical/non-technical stakeholders.





Day-one comprehensive health, vision and dental coverage, PTO, tuition reimbursement and employer-matched retirement funds are just a few of the great benefits offered to eligible co-workers, including those working 32 hours or more per pay period!



At Mercy, our supportive community will be behind you every step of your day, especially the tough ones. You will have opportunities to pioneer new models of care and transform the health care experience through advanced technology and innovative procedures. We're expanding to help our communities grow. Join us and be a part of it all.



Compassion and professionalism go hand-in-hand with us. Having a positive outlook and a strong sense of advocacy is in perfect step with our mission and vision. We're also collaborative and unafraid to do a little extra to deliver excellent care - that's just part of our commitment. If that sounds like a good fit for you, we encourage you to apply.

Mercy has determined this is a safety-sensitive position. The ability to work in a constant state of alertness and in a safe manner is an essential function of this job.",-1,10000+ Employees,1871,Nonprofit Organization,Health Care Services & Hospitals,Healthcare,$100 to $500 million (USD),-1,0,0,77.0,114.0,95.5,MO,152,0,0,0,1,1
Associate Data Scientist,Tencent,4.0,"Palo Alto, CA",Employer Provided Salary:$65K - $131K,"Work Mode:
Onsite
Responsibilities:
About Tencent
Tencent is a world-leading internet and technology company that develops innovative products and services to improve the quality of life of people around the world. Founded in 1998 with its headquarters in Shenzhen China, our guiding principle is to use technology for good.
We are not only a major video game publisher in the world, we also produce other high-quality digital content, enriching interactive entertainment experiences for people around the globe. We offer a range of services such as cloud computing, advertising, FinTech, and other enterprise services to support our clients' digital transformation and business growth.
About IEG






California
The base pay range for this position in the state(s) above is $65,450 to $130,900 per year. Actual pay is based on market location and may vary depending on job-related knowledge, skills, and experience. A sign on payment, relocation package, and restricted stock units may be provided as part of the compensation package, as well as other medical, financial, and/or other benefits, dependent on the specific position offered.",-1,10000+ Employees,1998,Company - Public,Internet & Web Services,Information Technology,Unknown / Non-Applicable,-1,0,1,65.0,131.0,98.0,CA,25,0,0,0,1,0
Sr. Data Scientist,"3G Federal Solutions, LLC",-1.0,Remote,Employer Provided Salary:$70.00 - $80.00 Per Hour,"Sr. Data Scientist
Location: 100 % REMOTE
Duration : 1 year plus extensions
Data Analyst/Scientist Role
We are looking for Data Analyst/Data Scientist to support operationalizing Security Governance and Risk (SG&R) Division`s Data Analytics Programs. The ideal candidate for this position will analyze, interpret, and support data solutions that enable businesses to make effective use of data in business decisioning.
Responsibilities",-1,1 to 50 Employees,-1,Company - Public,-1,-1,Unknown / Non-Applicable,-1,1,1,70.0,80.0,75.0,Remote,-1,0,0,0,1,0
Sports Data Scientist,Swish Analytics,5.0,Remote,Employer Provided Salary:$90K - $190K,"Company Description
Swish Analytics is a sports analytics, betting and fantasy startup building the next generation of predictive sports analytics data products. We believe that oddsmaking is a challenge rooted in engineering, mathematics, and sports betting expertise; not intuition. We're looking for team-oriented individuals with an authentic passion for accurate and predictive real-time data who can execute in a fast-paced, creative, and continually-evolving environment without sacrificing technical excellence. Our challenges are unique, so we hope you are comfortable in uncharted territory and passionate about building systems to support products across a variety of industries and consumer/enterprise clients.
Job Description",-1,1 to 50 Employees,2014,Company - Private,Gambling,"Arts, Entertainment & Recreation",Unknown / Non-Applicable,-1,0,1,90.0,190.0,140.0,Remote,9,0,0,0,1,1
Jr. Data Scientist,Kyla,3.5,"San Jose, CA",$91K - $131K (Glassdoor est.),"Job Type: Full Time
We are looking for Jr. Data Scientists to join our team.
Kyla is the next generation of healthcare tech. Our mission is to help people live longer and healthier. With the latest AI technologies, we provide the best digital healthcare for everyone. We have several digital products such as mobile app, and three web applications for companies and doctors. We work with Fortune 500 companies. Our solutions are used by thousands, and recently we won the Exceptional Innovation By The 2020 Pandemic Tech Innovation Awards. Our team is bright minds who love their job and development and are not afraid of working in a fast-growing lean startup.
If you would like to join us, do not hesitate to apply.
Required skills:",-1,1 to 50 Employees,-1,Company - Private,-1,-1,Unknown / Non-Applicable,-1,0,0,91.0,131.0,111.0,CA,-1,0,0,0,1,0
Data Scientist,Security Benefit,3.8,"Topeka, KS",$84K - $121K (Glassdoor est.),"Data Scientist positions available at Everly, LLC in Topeka, Kansas. To apply, submit resume and cover letter to: Julie Lind, AVP, Learning and Development, 1 Security Benefit Place, Topeka, Kansas 66636 or by email to Lind.recruit@securitybenefit.com. Job Duties: Using knowledge of Qlik, Tableau, SQL, NoSQL databases, and AWS platform, apply principled methods to quantitative insurance problems in areas such as estimating customer lifetime value, pricing and reserving, etc. Synthesize current business intelligence or trend data to support recommendations for action.

Devise methods for identifying data patterns and trends in available information sources. Collect & analyze business intelligence data from available industry reports, public information, field reports, or purchased sources. Identify and analyze industry or geographic trends with business strategy implications. Review data regarding competitors, suppliers, professional organizations to stay abreast of industry and business trends.

Produce financial and market intelligence through data repository queries, prepare reports. Implement, refine and improve our comprehensive suite of metrics, analyses, tools and dashboards. Democratize data access through our data platform and deliver outcome driven use cases. (Example: end to end view of customer funnel within our BI tool.) Develop, deploy, maintain, and continuously improve machine learning methods through online learning principles - initially focused on our customer experience.

data about lifestyle, age, and other application specific data used to tailor a policy to match the needs of the insured). Collaborate with partners to create and oversee our data strategy, enable data governance and monitor data quality. Maintain library of model documents, templates, or other reusable knowledge assets. Analyze technology trends to identify markets for future product development or to improve sales of existing products.

Conduct or coordinate tests to ensure that intelligence is consistent with defined needs. Troubleshoot and maintain technology stack to ensure continuous measurement of marketing performance, keeping in mind the future changes in the landscape. Provide support cross-functionally working through the entire data mining cycle -business problem, finding the correct data, cleaning, normalizing, mining for insights and surfacing them to the stakeholders. Minimum Education Requirement: Bachelor’s degree or foreign equivalent in Data Science, Business Analytics, Statistics, Electronics Engineering, or related field.

5% travel to conferences or for team meetings to unanticipated locations throughout the U.S.",-1,1001 to 5000 Employees,1891,Company - Private,Investment & Asset Management,Financial Services,Unknown / Non-Applicable,-1,0,0,84.0,121.0,102.5,KS,132,0,0,0,1,0
Data Scientist,NutaNXT Technologies,4.8,"Santa Clara, CA",$108K - $149K (Glassdoor est.),"Job Description
As a Data Scientist, you will help healthcare run efficiently through AI models that improve the distribution and manufacturing of healthcare products. You will understand key problems faced by business partners across the business, and ask good questions. You will brainstorm possible statistical solutions with help from Senior Data Scientists. You will own AI experiments, failing fast and pivot to the right solution. Finally, you will operationalize models with help from Senior Machine Learning Engineers.
Responsibilities
Extract data from multiple data sources like Microsoft SQL Server, Oracle, Azure Blob, and Azure SQL using SQL or Python",-1,1 to 50 Employees,-1,Company - Private,-1,-1,Unknown / Non-Applicable,-1,0,0,108.0,149.0,128.5,CA,-1,1,0,0,1,0
Junior Data Scientist,Soothsayer Analytics,2.9,"Livonia, MI",$81K - $113K (Glassdoor est.),"Junior Data Scientist
Working Hours : Full Time(W2)
Experience : 1+Years
Locations : Livonia , Michigan

Soothsayer is seeking Data Scientist who has an interest in solving challenging ML/ AI problems. The Data Science team works on a variety of exciting analytics (ML, AI) projects.",-1,Unknown,-1,Company - Private,Information Technology Support Services,Information Technology,Unknown / Non-Applicable,-1,0,0,81.0,113.0,97.0,MI,-1,0,0,0,1,0
Data Scientist,Redko,-1.0,Remote,Employer Provided Salary:$120K - $160K,"We are seeking a highly skilled and experienced Data Scientist to join our team and contribute to the development and optimization of our mobile app. As a Data Scientist, you will play a pivotal role in leveraging data to drive insights, improve decision-making, and enhance the overall user experience. You will collaborate closely with cross-functional teams, including product managers, developers, and marketers, to identify opportunities, conduct data analysis, and develop data-driven solutions. This is an exciting opportunity to apply your expertise in data science and make a significant impact on the success of our mobile app.
Responsibilities:
Collaborate with stakeholders to define and prioritize data-related requirements, goals, and objectives for the mobile app.",-1,-1,-1,-1,-1,-1,-1,-1,0,1,120.0,160.0,140.0,Remote,-1,0,0,0,1,0
Advanced AI Data Trainer,Invisible Technologies,3.8,Remote,Employer Provided Salary:$15.00 - $20.00 Per Hour,"Advanced AI Data Trainer - Fully Remote
Start a career in tech: Join the team that's supporting the latest cutting-edge AI language models.
Website | Video Demo | Core Values
The Business Context
You already use AI in many ways—like deciding what products and services to order—and it may be most familiar to you as a chatbot, as an avatar-maker, or as a way to unlock your screen. But here's what AI may be able to help the world with: finding medical diagnoses, teaching you about scientific research, and calculating the complexities of any function.",-1,51 to 200 Employees,2015,Company - Private,Software Development,Information Technology,Unknown / Non-Applicable,-1,1,1,15.0,20.0,17.5,Remote,8,0,0,0,1,0
Data Scientist - 300269,Grainger,4.1,"Lake Forest, IL",$93K - $125K (Glassdoor est.),"W.W. Grainger, Inc. is seeking a Data Scientist in Lake Forest, IL with the following requirements: Master’s degree in Statistics, Mathematics, Data Science, Computer Science or related field plus 1 year related experience. Prior experience must include: Analyze and interpret statistical data in the form of data visualization and statistic calculation, translate numerical findings into actionable insights and implementable solutions; Design and conduct experiments, collect the data to measure results and test hypotheses, create inferences and recommendations; Design, implement, and validate statistical and machine learning models like regression, decision trees, clustering, and time series modeling; Utilize statistical computer languages in SQL, Python, R, IBM SPSS Statistics, and MS Office; Present clear and concise results to business partners to adopt and implement analytical recommendations. Up to 20% remote work allowed.

Please submit resume to https://jobs.grainger.com/, reference job #300269",-1,10000+ Employees,1927,Company - Public,Wholesale,Retail & Wholesale,$10+ billion (USD),-1,0,0,93.0,125.0,109.0,IL,96,1,0,0,1,0
